<?xml version="1.0" encoding="UTF-8"?>
<!--Sample XML file generated by XMLSpy v2008 sp1 (http://www.altova.com)-->
<ns1:processor name="Sample XML processor" xsi:schemaLocation="http://stockprocessor/handler/xml processor.xsd" xmlns:ns1="http://stockprocessor/handler/xml" xmlns:xsi="http://www.w3.org/2001/XMLSchema-instance">
<!-- Input side -->
	<ns1:input name="Input">
		<ns1:wire processorName="Minimal processor" taget="Input"/>
	</ns1:input>
<!-- Output side -->
	<ns1:output name="Output 1" type="Candle data">
		<!--><ns1:wire processorName="Minimal processor" taget="Output"/>-->
	</ns1:output>
	<ns1:output name="Output 2" type="Number data">
		<ns1:wire processorName="nd1" taget="NumberData"/>
	</ns1:output>
<!-- Processors definitions -->
	<ns1:usedProcessors>
		<ns1:extrnalProcessor  name="nd1" library="Base Processors" type="Number data"/>
		<ns1:extrnalProcessor  name="nd2" library="Base Processors" type="Number data"/>
		<ns1:processor name="Minimal processor">
			<ns1:input name="Input"/>
			<ns1:output name="Output" type="Candle data"/>
			<ns1:usedProcessors/>
			<ns1:innerWire>
				<ns1:source taget="Input"/>
				<ns1:receiver taget="Output"/>
			</ns1:innerWire>
		</ns1:processor>
		<ns1:processor name="Minimal processor2">
			<ns1:input name="Input"/>
			<ns1:output name="Output" type="Candle data"/>
			<ns1:usedProcessors/>
			<ns1:innerWire>
				<ns1:source taget="Input"/>
				<ns1:receiver taget="Output"/>
			</ns1:innerWire>
		</ns1:processor>
	</ns1:usedProcessors>
<!-- Wires -->
	<ns1:innerWire>
		<ns1:source processorName="Minimal processor" taget="Output"/>
		<ns1:receiver processorName="nd1" taget="Input"/>
	</ns1:innerWire>
</ns1:processor>
